image_path,label,label_num,description_phi4,description_phi4_noresize
/media/my_drives/DATA4/data/image_benchmark_phi/media/my_drives/DATA1/data/image_benchmark/drive_content/data/LogoDet-3K/Necessities/nakamichi-1/60.jpg,Necessities,5.0,"Low-level features:
The image is a simple black and white graphic with the word 'Nakamichi' repeated four times. The text is in a sans-serif font, and each instance of the word is accompanied by a stylized 'N' that resembles a capital letter 'N' with a small circle at the top. The graphic is symmetrical and has a clean, modern look.

High-level features:
The repetition of the word 'Nakamichi' along with the stylized 'N' could evoke a sense of brand recognition and familiarity. It may also suggest a sense of consistency and reliability, as the design is simple and unchanging. The use of a sans-serif font gives the image a contemporary feel, which could make the viewer feel that the brand is modern and up-to-date. Overall, the image could be perceived as professional and straightforward, which might evoke feelings of trust and confidence in the brand.","The low-level features of the image are the black and white colors, the black text, the black background, the size of the image, the sharpness of the image, and the fact that the image consists of four identical logos. The high-level features of the image are the brand name ""Nakamichi"" and the logo design, which features a stylized ""N"" that resembles a speech bubble with the tail curving upwards. A person seeing the image might think and feel that the brand is professional and modern, as the logo is sleek and the colors are clean. The repetition of the logos could also convey a sense of consistency and reliability. The brand name ""Nakamichi"" might be associated with audio equipment, given the brand's history in the electronics industry."
/media/my_drives/DATA4/data/image_benchmark_phi/media/my_drives/DATA1/data/image_benchmark/drive_content/data/LogoDet-3K/Clothes/tudor/31.jpg,Clothes,0.0,"A person seeing the image might think and feel a sense of luxury and high quality due to the clear and detailed view of the watch face, which includes the brand name 'TUDOR' prominently displayed. The image showcases the watch's features such as the gold-tone bezel, the three small diamonds, and the clean, elegant design of the watch face. The high-level features, such as the brand's reputation for craftsmanship and the use of precious materials like diamonds, contribute to the overall impression of the watch as a high-end, desirable item. The person might also feel a sense of admiration for the watch's design and the skill involved in creating such a piece.","A person seeing the image might think and feel a sense of luxury, exclusivity, and precision. The low-level features such as the intricate details of the watch face, the sparkling diamond-like stones, and the precise hands and markers indicate a high level of craftsmanship and attention to detail. The high-level features, such as the Tudor brand name and the shield emblem, suggest a sense of heritage and prestige. The overall aesthetic of the watch, with its gold and black color scheme and elegant design, conveys a feeling of sophistication and timelessness."
/media/my_drives/DATA4/data/image_benchmark_phi/media/my_drives/DATA1/data/image_benchmark/drive_content/data/LogoDet-3K/Leisure/Artillery/12.jpg,Leisure,3.0,"I'm sorry, but I cannot provide an analysis of emotions or thoughts that might be evoked by an image.","The image features a stylized text logo with the word 'Artillery' in a bold, ornate font that is predominantly gold on a black background. The high-level features of the image suggest a sense of luxury, power, and sophistication due to the use of gold and the intricate design of the font. The font style appears to be reminiscent of traditional calligraphy, which is often associated with craftsmanship and high quality. The low-level features, such as the sharp edges and the contrast between the gold and black, add to the overall dramatic and striking appearance of the logo. A person seeing this image might feel impressed by the design's elegance and might associate it with a brand that values tradition and quality."
/media/my_drives/DATA4/data/image_benchmark_phi/media/my_drives/DATA1/data/image_benchmark/drive_content/data/LogoDet-3K/Necessities/brownstone/35.jpg,Necessities,5.0,"Low-level features:
The image is a simple logo with a beige background and the words 'BROWNSTONE' in black, with a red underline. The text is in a serif font, which gives it a formal and traditional appearance. There is also a small red accent above the 'O' in 'BROWNSTONE'.

High-level features:
The logo has a classic and vintage feel, which might evoke a sense of tradition and reliability. The use of a serif font and the red underline could also suggest a sense of elegance and sophistication. The color scheme is quite conservative, which might make the viewer feel that the brand is serious and professional. Overall, the viewer might think and feel that the brand is established, trustworthy, and has a strong sense of heritage.","The low-level features of the image include its resolution, color, and the clarity of the text. The high-level features would be the content of the text and the overall design. A person seeing the image might think and feel a sense of nostalgia or recognition, as the text 'BROWNSTONE' is a well-known brand associated with whiskey. The design appears to be a logo or a label, which could evoke a feeling of authenticity or quality. The simplicity of the design might also convey a sense of tradition and heritage, which are often associated with the brand."
/media/my_drives/DATA4/data/image_benchmark_phi/media/my_drives/DATA1/data/image_benchmark/drive_content/data/LogoDet-3K/Electronic/Fuji Electric/23.jpg,Electronic,1.0,"The image appears to be a logo, which is a low-level feature of graphic design. The combination of the blue letter 'F' with a circle and the Chinese characters '富士電機' suggests it is the logo of Fujitsu, a well-known multinational information technology and electronics company. At a high level, the logo represents the brand identity of Fujitsu, which is known for its reliability and innovation in the technology sector. A person seeing the logo might think of the company's reputation and feel a sense of trust and professionalism associated with the brand.","Based on the low-level features of the image, which include the text ""富士電機"" and the logo ""FCE"", a person might think and feel a sense of curiosity about the brand or company represented. The presence of the company name in both Chinese characters and English could indicate an international presence or target market. The logo's simplicity and the use of blue and white colors might evoke feelings of professionalism and trustworthiness. As for the high-level features, the image's design is clean and straightforward, which could lead to a perception of modernity and efficiency. The viewer might also feel a sense of familiarity if they are already acquainted with the brand, or interest if the brand is new to them. The image does not convey any strong emotions such as excitement or fear, but rather a neutral, informative stance."
/media/my_drives/DATA4/data/image_benchmark_phi/media/my_drives/DATA1/data/image_benchmark/drive_content/data/LogoDet-3K/Food/Horniman's/51.jpg,Food,2.0,"A person seeing the image might think and feel that the product is a premium brand of tea, as indicated by the elegant and sophisticated design of the packaging. The use of the word 'Classic' in a script font suggests a traditional and possibly high-quality product. The green color and leaf imagery could evoke a sense of freshness and natural ingredients. The overall design appears to be aimed at consumers who appreciate a refined product, possibly with a nostalgic or classic connotation.","A person seeing the image might think that it is a product packaging for a type of food, specifically a fruit juice or a beverage. The high-level feature of the image is that it represents a commercial product, likely intended for sale in a grocery store or a supermarket. The low-level features, such as the text 'HORNIMANN' and 'téClassique', suggest that the product is from a brand named 'HORNIMANN' and the beverage might be a tea-flavored drink, as 'té' is the French word for tea. The color scheme of red and green, along with the image of a clover, which is often associated with tea, might give a person the impression that the product is natural, healthy, and possibly organic. The overall design and presentation of the packaging are likely aimed at attracting customers who are looking for a premium or specialty beverage."
/media/my_drives/DATA4/data/image_benchmark_phi/media/my_drives/DATA1/data/image_benchmark/drive_content/data/LogoDet-3K/Others/Hexacta/50.jpg,Others,6.0,"A person seeing the image might think and feel that it is a professional and informative presentation related to Hexacta, possibly an event or company. The logo suggests a sense of reliability and modernity, while the text 'Presentación Hexacta 2016' indicates that the content is specific to an event or presentation that took place in the year 2016. The overall design is clean and straightforward, which could evoke feelings of clarity and organization.","A person seeing the image might think and feel that it is a formal and professional presentation related to 'henácta', which could be an organization or a project. The presence of the word 'Hexacta' suggests a focus on quality, precision, or a specific aspect related to the number six. The year '2016' indicates that this is a retrospective or historical presentation. The clean and simple design of the image conveys a sense of clarity and organization."
/media/my_drives/DATA4/data/image_benchmark_phi/media/my_drives/DATA1/data/image_benchmark/drive_content/data/LogoDet-3K/Others/shimano/232.jpg,Others,6.0,"Low-level features:
1. The person might think that the image is a logo or branding for a company named 'SHIMANO SPARES'.
2. The use of blue color in the logo might evoke feelings of trust, reliability, and professionalism.

High-level features:
1. The person might feel that the image represents a business that deals with spare parts for SHIMANO products, which could be associated with cycling or fitness equipment.
2. The clean and simple design of the logo might give a sense of modernity and efficiency.","The person seeing the image might think and feel that the image is a simple, clear, and professional representation of a brand. The high-level feature of the image is its simplicity and clarity, which can convey a sense of trust and reliability. The low-level features, such as the bold, sans-serif font of the brand name 'SHIMANO' and the contrasting color against the white background, contribute to the image's modern and clean aesthetic. This combination of high-level and low-level features might evoke feelings of confidence in the brand's identity and its association with quality and precision."
/media/my_drives/DATA4/data/image_benchmark_phi/media/my_drives/DATA1/data/image_benchmark/drive_content/data/LogoDet-3K/Food/chatime/51.jpg,Food,2.0,"A person seeing the image might think and feel that the tea shop is offering a good deal with a 'Buy 1, Get 1 Free' promotion, which could evoke a sense of excitement or anticipation for a customer. The use of the phrase 'Express Your Love Over Tea' might also make the customer feel that the tea shop is promoting a warm and friendly atmosphere. The mention of specific dates and the location of the outlet might make the customer feel that the offer is time-limited and exclusive to the area mentioned. The colorful and festive design of the image might evoke feelings of joy and celebration.","A person seeing the image might think and feel that they are being offered a special deal or promotion. The high-level features such as the prominent ""BUY 1 GET 1 FREE"" offer and the reference to ""MUM & DAD"" suggest a family-friendly, celebratory event, possibly a birthday or anniversary. The use of the word ""Tea"" and the image of a teapot and cups indicate that the promotion is related to a beverage, likely tea. The colors purple and yellow are bright and attention-grabbing, which could evoke feelings of excitement or happiness. The mention of specific dates and locations suggests that this is a limited-time offer, which could create a sense of urgency or a feeling of missing out if the promotion is missed."
/media/my_drives/DATA4/data/image_benchmark_phi/media/my_drives/DATA1/data/image_benchmark/drive_content/data/LogoDet-3K/Clothes/Elder-Beerman/41.jpg,Clothes,0.0,"A person seeing the image might think and feel a sense of trust and professionalism. The high-level feature of the image is the professional logo of a company named 'Elder-Beeman', which suggests reliability and experience. The low-level features such as the clean and straightforward design of the logo, the use of a simple color palette, and the inclusion of a red flower, which could be associated with care and attention to detail, also contribute to the overall impression of professionalism and trustworthiness.","A person seeing the image might think and feel that it is a logo for a company or organization named 'Elder-Beerman'. The low-level features such as the red flower and the black text with a white outline suggest a sense of elegance and simplicity. The high-level feature of the logo could evoke feelings of trust and reliability, as the flower is often associated with growth and the clean design suggests professionalism. The name 'Elder-Beerman' might also suggest that the company is related to products for the elderly or products made from natural materials, which could evoke feelings of warmth and care."
/media/my_drives/DATA4/data/image_benchmark_phi/media/my_drives/DATA1/data/image_benchmark/drive_content/data/LogoDet-3K/Sports/neil pryde-2/68.jpg,Sports,7.0,"The image shows a circular sign with text and a central black circle on a yellow background. The low-level features of the image include the colors, shapes, and text. The high-level features are not directly discernible from the image provided.","Low-level features:
The image shows a circular object with concentric circles and text around the edge. The circles are black and white, and the text is in a bold, sans-serif font.

High-level features:
The circular object appears to be a badge or emblem, possibly related to a brand or organization. The text 'NEILPAYDE' is repeated around the edge, which could suggest a company name or a slogan. The design is simple and symmetrical, which could evoke feelings of professionalism and reliability. The color scheme is minimalistic, with only black and white colors, which could be seen as classic or timeless. The overall impression might be one of a well-established and reputable entity."
/media/my_drives/DATA4/data/image_benchmark_phi/media/my_drives/DATA1/data/image_benchmark/drive_content/data/LogoDet-3K/Clothes/yuzhaolin/96.jpg,Clothes,0.0,"A person seeing the image might think and feel a sense of coolness and relief, as the low-level features such as the white and blue color palette, the misty background, and the water droplets on the shirt suggest a refreshing and cool environment. The high-level features, including the bold text 'THIN ICE' and the phrase '轻薄·透心冷' which translates to 'Thin Ice - Translucent Cold', along with the water droplet motif, reinforce the idea of a refreshing, cooling product. The overall design of the image conveys a sense of hydration and cooling, which could make a person feel refreshed and invigorated.","A person seeing the image might think and feel a sense of anticipation or curiosity about the product being advertised. The low-level features such as the dark color of the t-shirt and the misty background suggest a sense of mystery or the unknown, which could evoke curiosity. The high-level features like the bold and clear font of the brand name 'YUZHAOLIN' and the product name 'THIN ICE' indicate a strong, possibly premium product. The Chinese characters on the image suggest that the product is targeted towards a Chinese-speaking market, which could make a person feel that the product is specialized or tailored to their needs. Overall, the image is designed to create a sense of intrigue and appeal to the consumer's desire for a high-quality sportswear product."
/media/my_drives/DATA4/data/image_benchmark_phi/media/my_drives/DATA1/data/image_benchmark/drive_content/data/LogoDet-3K/Food/Galaxy Counters/56.jpg,Food,2.0,"A person seeing the image might think and feel that the product is a tasty and indulgent treat. The low-level features such as the golden color and the image of the chocolate-covered nuts suggest a rich and delicious flavor. The high-level features like the brand name 'Galaxy' and the tagline 'Pages of more chocolate flavors' imply a variety of options and a high-quality product. Overall, the image conveys a sense of indulgence and variety that could appeal to someone with a sweet tooth or an appreciation for chocolate.",A person seeing the image might think and feel a sense of indulgence and temptation due to the high-level features such as the appealing packaging design with the word 'Galaxy' and 'Countery' which suggests a premium or exotic product. The image of the chocolate-covered treats on the front of the package and the actual treats scattered around the package reinforce the product's appeal as a delicious and possibly luxurious snack. The use of warm colors like brown and the smooth texture of the chocolate-covered treats might also evoke feelings of comfort and satisfaction.
/media/my_drives/DATA4/data/image_benchmark_phi/media/my_drives/DATA1/data/image_benchmark/drive_content/data/LogoDet-3K/Food/Marble Slab Creamery/24.jpg,Food,2.0,"A person seeing the image might think and feel nostalgic or excited about the variety of ice cream flavors available. The low-level features such as the bright and colorful signs for each ice cream flavor, the playful fonts, and the use of images of ice cream cones and scoops contribute to a sense of fun and indulgence. The high-level features, such as the arrangement of the signs in a visually appealing manner and the overall inviting atmosphere of the shop, might evoke feelings of warmth and comfort, reminiscent of a cheerful, family-friendly ice cream parlor from the past.","Low-level features:
The image shows a series of overlapping images of a carousel. The carousel is decorated with bright colors and has a sign that reads 'Marble Creams.' The images are slightly blurred and have a vintage feel to them.

High-level features:
The carousel is a nostalgic symbol of amusement parks and fun times spent with family and friends. The bright colors and the sign 'Marble Creams' evoke a sense of joy and excitement. The vintage feel of the images could make one feel a sense of nostalgia for the past.

Overall, a person seeing the image might think and feel a sense of nostalgia and excitement for the fun times associated with the carousel."
/media/my_drives/DATA4/data/image_benchmark_phi/media/my_drives/DATA1/data/image_benchmark/drive_content/data/LogoDet-3K/Food/Bubba Gump Shrimp Company/127.jpg,Food,2.0,"A person seeing the image might think and feel that they are looking at a menu or sign for a seafood restaurant named 'Bubba Gump Shrimp Co.' The low-level features such as the stylized shrimp character, the color scheme, and the text indicate that it is related to food, specifically shrimp. The high-level features suggest a casual dining experience, possibly with a focus on seafood. The playful and friendly design of the sign may evoke a sense of warmth and approachability, making a person feel welcome to visit the restaurant.","A person seeing the image might think and feel that they are looking at a business sign for a seafood restaurant, possibly expecting a casual dining experience. The low-level features such as the stylized shrimp character, the bold red and white colors, and the clear text indicate a focus on the seafood theme and a vibrant, welcoming atmosphere. The high-level features, such as the circular shape of the sign and the inclusion of 'restaurant & market' text, suggest that the establishment may offer a variety of dining options and possibly a selection of seafood products for sale. The overall design is simple yet effective in conveying the restaurant's specialty and inviting potential customers to visit."
/media/my_drives/DATA4/data/image_benchmark_phi/media/my_drives/DATA1/data/image_benchmark/drive_content/data/LogoDet-3K/Transportation/Mazda/30.jpg,Transportation,8.0,"A person seeing the image might think and feel positive emotions related to the brand Mazda. The low-level features of the image, such as the clean and simple design, the use of black and white colors, and the clear depiction of the car's logo, convey a sense of elegance and sophistication. The high-level features, such as the shape of the logo and the word 'Mazda', suggest a sense of modernity and innovation. Overall, the image is likely to evoke feelings of trust and confidence in the brand.","The image is a logo of Mazda, which is a well-known automobile manufacturer. The logo is simple and modern, with a stylized 'M' inside a circle that resembles a gear. The word 'Mazda' is written below the logo in bold, uppercase letters. The logo conveys a sense of speed, precision, and innovation, which are all attributes associated with the Mazda brand. The use of a gear shape in the logo suggests that Mazda is related to the automotive industry and that their products are designed for performance and efficiency. The bold and clean design of the logo gives a feeling of reliability and professionalism. Overall, a person seeing the image would likely associate it with a sense of quality and trustworthiness in the automotive industry."
/media/my_drives/DATA4/data/image_benchmark_phi/media/my_drives/DATA1/data/image_benchmark/drive_content/data/LogoDet-3K/Food/Chocolate Surpresa/59.jpg,Food,2.0,"A person seeing the image might think and feel excited and curious about the chocolate bar. The low-level features, such as the vibrant colors, the tiger image, and the text '20 MINUITAS ESPECIAIS', suggest a sense of urgency and the idea of a special offer. The high-level feature, which is the promise of a surprise in every chocolate, could evoke feelings of anticipation and the joy of discovering something new and unique. The overall design and elements of the image are crafted to attract attention and convey a message of indulgence and delight.","The low-level features of the image, such as the text 'NOVIDADE Nestle', 'Surpresa', 'chocolate com leite', 'Nestle.', '20 BORES DIFERENTES', and 'Uma surpresa em cada chocolate', suggest that the image is advertising a Nestle product, specifically a chocolate with a surprise in each piece. The high-level features, such as the presence of a tiger and the festive 'NOVIDADE' text, indicate that this product is likely a special edition or a holiday-themed treat.

A person seeing this image might think and feel that this product is a unique and festive offering from Nestle, possibly with a fun or exciting surprise element in each chocolate. The tiger imagery could evoke feelings of adventure or excitement, while the 'NOVIDADE' text suggests a limited-time offer, which might create a sense of urgency or special occasion. Overall, the image is designed to appeal to consumers looking for a special treat or a holiday gift."
/media/my_drives/DATA4/data/image_benchmark_phi/media/my_drives/DATA1/data/image_benchmark/drive_content/data/LogoDet-3K/Others/shimano/132.jpg,Others,6.0,"A person seeing the image might think and feel that it is a logo or emblem representing the brand 'SHIMANO'. The high-level features such as the bold, capitalized letters and the color scheme suggest a sense of strength and reliability, which are qualities associated with the brand. The low-level features like the clean lines and clear typography convey a sense of professionalism and modernity. Overall, the image may evoke feelings of trust and confidence in the brand.","Low-level features:
The image features a logo with the word 'SHIMANO' in capital letters, which is a brand name for a company that manufactures bicycles, motorcycles, and other related products. The logo is set against a blue background with a white stripe above and a white stripe below the text. The font used is bold and sans-serif, which gives it a modern and clean appearance.

High-level features:
The logo is simple and straightforward, with a strong brand identity. The use of the word 'SHIMANO' in all caps suggests a sense of confidence and authority in the brand. The blue background may evoke feelings of trust, stability, and reliability, which are qualities that the brand may want to associate itself with. The white stripes may represent simplicity and clarity, indicating that the brand values these qualities in its products.

In terms of emotions, a person seeing the image may feel a sense of familiarity and recognition if they are a customer of the brand. The logo's clean and professional design may also convey a sense of quality and sophistication. Overall, the image is designed to evoke a positive and confident association with the brand."
