image_path,label,label_num,description_phi4,description_phi4_noresize
/media/my_drives/DATA4/data/image_benchmark_phi/media/my_drives/DATA1/data/image_benchmark/drive_content/data/LogoDet-3K/Food/sanquan/80.jpg,Food,2.0,"A person seeing the image might think and feel that it represents a brand or company that focuses on a comprehensive range of products, as suggested by the red color which is often associated with energy, passion, and action. The high-level feature of the image, such as the stylized human figure, could evoke feelings of modernity and innovation. The low-level features like the bold red color and the clean, sans-serif font might convey professionalism and reliability. Overall, the image could be perceived as dynamic and forward-thinking.","A person seeing the image might think and feel a sense of familiarity or recognition due to the high-level features of the logo, which includes the stylized text and the color scheme. The low-level features such as the gradient fill and the shadow effect add depth and a modern touch to the logo, which might evoke feelings of professionalism and innovation. The combination of these elements could lead to a perception of the brand as contemporary and dynamic."
/media/my_drives/DATA4/data/image_benchmark_phi/media/my_drives/DATA1/data/image_benchmark/drive_content/data/LogoDet-3K/Necessities/revlon/14.jpg,Necessities,5.0,"A person seeing the image might think and feel that it is a straightforward and professional representation of the 'REVLON WIGS' brand. The low-level features such as the clear, sans-serif font and the checkered background suggest a sense of simplicity and transparency, which could evoke feelings of trust and clarity. The high-level features, such as the trademark symbol and the distinct brand name, reinforce the identity and quality associated with the Revlon brand, potentially making a person feel confident in the brand's reputation for quality hair products.","Low-level features:
1. The image is a simple logo with the brand name 'REVLON' and the product type 'WIGS'.
2. The logo uses a sans-serif font, which is clean and modern.
3. The color scheme is limited to black and white, which is classic and timeless.

High-level features:
1. The logo conveys a sense of luxury and quality, which is associated with the brand 'REVLON'.
2. The use of the registered trademark symbol (®) suggests that 'REVLON' is a well-established and recognized brand.
3. The logo is straightforward and easily recognizable, which can evoke feelings of trust and reliability in the consumer.

In summary, a person seeing the image might think of a high-end, reliable brand that offers quality hair wigs. They might feel a sense of trust and confidence in the brand based on the logo's design and the established reputation of 'REVLON'."
/media/my_drives/DATA4/data/image_benchmark_phi/media/my_drives/DATA1/data/image_benchmark/drive_content/data/LogoDet-3K/Food/Honey Kix/42.jpg,Food,2.0,"A person seeing the image might think and feel intrigued by the product's presentation and the brand's attempt to convey a natural and organic quality. The high-level feature of the image is the clear, well-lit photograph of the chickpeas, which allows the viewer to easily identify the product. The low-level features include the color contrast between the green can and the yellow chickpeas, the use of the word 'honey' suggesting a sweet flavor, and the small icons that indicate the product is gluten-free and vegan. These features collectively create a sense of trust and appeal to health-conscious consumers.","A person seeing the image might think and feel that it is a product advertisement for a brand called 'honey kix'. The low-level features such as the text 'honey kix', the image of the yellow beads, and the nutritional information on the label would inform the viewer about the product's brand, its contents, and its nutritional value. The high-level features such as the overall design, color scheme, and layout would give the viewer a sense of the product's quality and the brand's marketing strategy. The viewer might feel interested in trying the product, especially if they are looking for a snack or a food item with nutritional benefits."
/media/my_drives/DATA4/data/image_benchmark_phi/media/my_drives/DATA1/data/image_benchmark/drive_content/data/LogoDet-3K/Clothes/movado/2.jpg,Clothes,0.0,"The image shows a logo with the text 'MOVADO', which is a brand name. The high-level feature of the image is the brand identity that it represents. The low-level features include the typography and design elements of the logo. A person seeing the image might think and feel that it represents a professional and possibly high-quality brand, given the clean and straightforward design of the logo.","The image features a simple and clean design with a logo and the word 'MOVADO'. The low-level features include a black and white color scheme, a circular logo with the letter 'M' inside it, and the word 'MOVADO' written in capital letters below the logo. The high-level features suggest a professional and modern brand identity. A person seeing this image might think and feel that the brand is sleek, contemporary, and possibly associated with high-quality products or services. The use of a bold font and the inclusion of the 'M' logo could also convey a sense of trust and reliability. For model testing purposes, it would be important to ensure that the image is clear and legible, and that the brand identity is well-represented. The image should evoke a sense of professionalism and modernity."
/media/my_drives/DATA4/data/image_benchmark_phi/media/my_drives/DATA1/data/image_benchmark/drive_content/data/LogoDet-3K/Clothes/Caslon/13.jpg,Clothes,0.0,"A person seeing the image might think and feel a sense of nostalgia and appreciation for classic sneaker design, given the high-level features such as the iconic 'adidas' branding, the distinctive three stripes, and the classic white color scheme. The low-level features, such as the clean lines, the sleek design of the laces, and the eyelets, contribute to the overall timeless aesthetic of the sneakers. The presence of the cartoon character and the Chinese text might evoke a sense of fun and inform the viewer that these sneakers are associated with a brand that is likely popular in China.","A person seeing the image might think and feel that the image showcases a variety of stylish and trendy sneakers available for purchase. The low-level features include the specific design elements of the shoes, such as the white color, the Adidas logo, the different color accents, and the overall shape and structure of the sneakers. The high-level features include the branding of the sneakers, the presence of the Casilon logo, and the overall aesthetic appeal of the image. For model testing purposes, the image could be used to gauge consumer interest in the sneakers, assess the effectiveness of the branding, and evaluate the overall visual impact of the product presentation."
/media/my_drives/DATA4/data/image_benchmark_phi/media/my_drives/DATA1/data/image_benchmark/drive_content/data/LogoDet-3K/Transportation/batavus/43.jpg,Transportation,8.0,"Low-level features:
The image is of a simple logo with a red swoosh and the word 'BATAVUS' in capital letters below it. The logo is predominantly in red and white color. The swoosh is a stylized representation of a bird in flight, and the word 'BATAVUS' is written in a bold, sans-serif font.

High-level features:
The logo conveys a sense of dynamism and freedom, as the bird in flight is often associated with these qualities. The use of the word 'BATAVUS' could suggest a connection to the Batavia, a city in the Netherlands, possibly indicating a Dutch origin or influence. The red color is often associated with energy, passion, and action, which could evoke feelings of excitement or enthusiasm. Overall, the person seeing the image might think of a brand or organization that values these qualities and has a connection to the city of Batavia.","The low-level features of the image include a red and white logo with a stylized 'B' that resembles a flame or a bird in flight. The high-level features include the company name 'BATAVUS' written in capital letters below the logo. A person seeing the image might think and feel that the company has a dynamic and energetic brand identity, as suggested by the flame-like design of the logo. The use of red, a color often associated with passion and action, could evoke feelings of excitement and enthusiasm. The simplicity of the design might also convey a sense of modernity and straightforwardness."
/media/my_drives/DATA4/data/image_benchmark_phi/media/my_drives/DATA1/data/image_benchmark/drive_content/data/LogoDet-3K/Clothes/Joma-1/41.jpg,Clothes,0.0,"A person seeing the image might think and feel a sense of confidence and style. The low-level features such as the dark color and the quilted pattern give the shoe a classic and durable look, which might make the viewer associate it with quality and reliability. The high-level features, including the white swoosh logo and the yellow accents, add a touch of modernity and brand recognition, which could evoke feelings of being trendy and fashionable. Overall, the shoe seems to be a blend of traditional craftsmanship and contemporary design, which could appeal to someone looking for a versatile and stylish footwear option.","The image is of a shoe, which is a low-level feature. However, the high-level features such as the design, color, and brand can evoke different thoughts and feelings. A person seeing the image might think and feel that the shoe is modern and stylish, given the combination of black, white, and yellow colors. The brand logo suggests a certain level of quality and prestige, which might make the person feel that the shoe is a desirable and high-end product. The white sole with a tread pattern could make the person think that the shoe is designed for durability and performance. Overall, the image might evoke a positive feeling towards the shoe, making the person consider it as a potential purchase."
/media/my_drives/DATA4/data/image_benchmark_phi/media/my_drives/DATA1/data/image_benchmark/drive_content/data/LogoDet-3K/Leisure/mcintosh/22.jpg,Leisure,3.0,"Based on the image, a person might think and feel a sense of curiosity or intrigue due to the partially visible text 'Melnosh' which could be a brand, product, or event. The high-level features such as the logo design and the context of the image (a display or case) might suggest a commercial or promotional purpose, which could evoke feelings of interest in the product or service being advertised. The low-level features, such as the lighting and the clarity of the logo, contribute to the overall impression and could affect the viewer's perception of the brand's professionalism and quality.","Low-level features:
The image shows a reflective surface with a logo that reads 'McIntosh' in a stylized font. The logo is surrounded by a circular design that resembles a network or a mesh of lines. The surface appears to be part of a larger object, possibly a device or a piece of furniture, as indicated by the wooden frame visible at the top edge of the image.

High-level features:
The logo suggests that the image is related to a brand or company named McIntosh, which is known for audio equipment. The reflective surface could imply that the image is taken from the perspective of someone looking at the logo from above, possibly at a store display or a product. The presence of the wooden frame might indicate that the image is taken from a higher angle, such as a customer's viewpoint in a retail setting.

A person seeing the image might think and feel a sense of brand recognition, especially if they are familiar with McIntosh as a company. The reflection and the angle at which the image is taken might evoke a sense of curiosity about the product or the brand. The image could also evoke a feeling of being in a store or a showroom, where one might feel the desire to explore the products on display."
/media/my_drives/DATA4/data/image_benchmark_phi/media/my_drives/DATA1/data/image_benchmark/drive_content/data/LogoDet-3K/Food/sasini/3.jpg,Food,2.0,"A person seeing the image might think and feel that they are looking at a variety of coffee products from a brand called 'Sasini'. The low-level features such as the images of the coffee, the packaging, and the text on the boxes indicate the different types and flavors of coffee available. The high-level feature is the brand's message that it has been around since 1952, suggesting a long-standing tradition and possibly a reputation for quality. The phrase 'Truly Kenyan, Truly Refreshing' could evoke a feeling of authenticity and a promise of a refreshing experience. Overall, the image conveys a sense of variety, tradition, and quality in coffee products.","A person seeing the image might think and feel that it is a commercial advertisement for a Kenyan coffee brand called 'Sasini'. The high-level features that convey this include the prominent display of the brand name 'Sasini' at the top of the image, the tagline 'Since 1952', and the mention of 'Truly Kenyan, Truly Refreshing' at the bottom. The low-level features that contribute to this interpretation include the visual elements such as the images of the coffee products, the packaging, and the cups, which are all associated with coffee consumption. The color scheme, with the use of green and brown tones, may also evoke a natural and organic feel, which is often associated with coffee. The overall composition of the image, with the products arranged in a way that suggests variety and availability, might make a person feel that they are seeing a range of options to choose from when purchasing coffee from the Sasini brand."
/media/my_drives/DATA4/data/image_benchmark_phi/media/my_drives/DATA1/data/image_benchmark/drive_content/data/LogoDet-3K/Clothes/amnesia/49.jpg,Clothes,0.0,"A person seeing the image might think and feel a sense of elegance and sophistication due to the high-level features such as the elegant font and the inclusion of a rose, which often symbolizes beauty and grace. The low-level features, such as the checkered background, suggest that the image might be a logo or a graphic design, which could evoke feelings of professionalism and attention to detail.","The image features a stylized logo with the word 'AMNEIA' and a floral element. The low-level features include a clear and legible font, a well-defined letter 'A', and a simple floral design. The high-level features suggest a sense of elegance and femininity, possibly indicating that the logo is for a brand related to beauty, fashion, or a similar industry. The viewer might feel a sense of sophistication or appreciation for the design's artistic quality."
/media/my_drives/DATA4/data/image_benchmark_phi/media/my_drives/DATA1/data/image_benchmark/drive_content/data/LogoDet-3K/Sports/wilson/55.jpg,Sports,7.0,"A person seeing the image might think of strength, courage, and readiness for action due to the bold, capitalized text 'WILSON COMBAT.' The eagle, a symbol of freedom and high vision, could evoke feelings of empowerment and determination. The 'C' in the middle might remind someone of the military or a specific unit or organization, which could instill a sense of pride or affiliation. Overall, the image's high-level features convey a message of combat readiness and low-level features like the eagle's sharp eyes and talons suggest vigilance and attack capability.","A person seeing the image might think and feel a sense of strength, resilience, and readiness for action. The bold, capitalized letters of ""WILSON COMBAT"" convey a sense of seriousness and authority. The use of blue could evoke feelings of trust, reliability, and stability. The eagle, a symbol of freedom and power, combined with the wings could make a person feel inspired and motivated. The overall design suggests preparedness for challenges and a strong spirit."
/media/my_drives/DATA4/data/image_benchmark_phi/media/my_drives/DATA1/data/image_benchmark/drive_content/data/LogoDet-3K/Food/Chocolate Cheerios/108.jpg,Food,2.0,"A person seeing the image might think that the product is a food item, specifically a type of cereal, and they might feel a sense of hunger or desire to eat. The low-level features such as the text 'Cheerios' and 'chocolate' indicate the brand and flavor of the cereal, while the high-level features such as the image of the cereal on a spoon suggest that it is a ready-to-eat breakfast product. The 'FORMAT FAMILIAL' label may also evoke a feeling of warmth or comfort, suggesting that the product is suitable for family consumption.","A person seeing the image might think and feel a sense of nostalgia or comfort, as the product is a Cheerios cereal box, which is a well-known brand associated with family breakfasts and comfort food. The high-level features such as the brand name 'Cheerios' and the image of the cereal on a spoon suggest a product that is ready to eat and associated with a wholesome, family-oriented experience. The low-level features like the color scheme, the font style, and the image of the cereal also contribute to a warm and inviting feeling."
/media/my_drives/DATA4/data/image_benchmark_phi/media/my_drives/DATA1/data/image_benchmark/drive_content/data/LogoDet-3K/Sports/mountainsmith/26.jpg,Sports,7.0,"A person seeing the image might think and feel a sense of nostalgia or familiarity due to the retro design of the logo. The high-level feature of the logo, which is the combination of the black anvil and the yellow background, suggests a connection to craftsmanship or traditional metalworking. The low-level features, such as the bold, capitalized font and the clean lines of the anvil, convey a sense of strength and durability. The overall design of the logo might evoke feelings of reliability and quality in the products or services offered by the brand it represents.","The person seeing the image might think and feel that they are looking at a logo or branding for a company or product named 'MOUNTRINSMITH'. The low-level features such as the yellow and black color scheme, the silhouette of a pot in the center, and the bold, capitalized font of the word 'MOUNTRINSMITH' contribute to a strong visual identity that is easily recognizable. The high-level features, such as the simplicity of the design and the use of a single object (the pot), suggest a focus on functionality or practicality, which might evoke feelings of reliability or craftsmanship. Overall, the image is likely to be perceived as professional and straightforward, with a clear message of quality and simplicity."
/media/my_drives/DATA4/data/image_benchmark_phi/media/my_drives/DATA1/data/image_benchmark/drive_content/data/LogoDet-3K/Necessities/playtex/5.jpg,Necessities,5.0,"A person seeing the image might think and feel positive emotions due to the high-level features of the image. The Playtex logo is bright and eye-catching, with a bold red color that stands out against the white background. The white font used for the brand name is easy to read and adds to the overall clarity of the image. The logo's simplicity and bold design convey a sense of confidence and professionalism. Additionally, the use of a registered trademark symbol indicates that the brand is recognized and established in the market, which might evoke feelings of trust and reliability in the viewer.","The image features a simple and bold logo with a red background and white cursive text that reads ""Playtex."" The low-level features of the image include the color contrast between the red background and the white text, which makes the logo stand out and easily recognizable. The cursive font adds a sense of elegance and sophistication to the design. The high-level features of the image convey a sense of brand identity and professionalism. A person seeing the image might think of the Playtex brand as reliable and trustworthy, and they might feel a sense of confidence and familiarity with the brand. The image is simple and straightforward, which can evoke a feeling of ease and simplicity in the viewer. Overall, the image is designed to create a positive and memorable impression of the Playtex brand."
/media/my_drives/DATA4/data/image_benchmark_phi/media/my_drives/DATA1/data/image_benchmark/drive_content/data/LogoDet-3K/Others/millet-2/23.jpg,Others,6.0,"A person seeing the image might think that it is related to a company or brand named 'MILET'. The low-level features such as the black color, the letter 'M', and the letter 'I' suggest a modern and minimalistic design. The high-level features like the logo and the name 'MILET' might evoke feelings of professionalism and trust, as the design is clean and straightforward, which is often associated with reliability and competence in a business context.","The image is a simple and clean logo with the word 'MILLET' and a stylized 'M' that resembles a mountain or a peak. The low-level features of the image include the black and white color scheme, the font type, and the shape of the 'M'. The high-level features include the simplicity and minimalism of the design, which could evoke feelings of modernity and sophistication. A person seeing the image might think of a brand that values simplicity, elegance, and possibly a connection to nature or the outdoors, given the mountain-like design of the 'M'. The font is modern and sleek, which could make the viewer feel that the brand is contemporary and forward-thinking. Overall, the image could be associated with a high-end, possibly luxury brand that has a clean and minimalist aesthetic."
/media/my_drives/DATA4/data/image_benchmark_phi/media/my_drives/DATA1/data/image_benchmark/drive_content/data/LogoDet-3K/Clothes/septwolves/28.jpg,Clothes,0.0,"The low-level features of the image, such as the black background, white text, and white outline of a wolf, create a stark contrast that is visually striking. The high-level features, such as the logo and the text ""SEPTWOLVES EST.1990"", suggest a brand or organization that has been established since 1990. A person seeing this image might think of a professional and established entity, potentially evoking feelings of trust, reliability, and longevity.","The image is likely to evoke a sense of strength and wildness, as suggested by the stylized wolf logo and the text 'SEPTWOLVES EST.1990'. The simplicity of the design and the use of a single color (black and white) could also give a feeling of sophistication and timelessness. The high-level feature of the image, which is the logo, represents the brand identity of 'SEPTWOLVES', and the low-level feature, which is the color contrast, makes the logo stand out and easily recognizable."
/media/my_drives/DATA4/data/image_benchmark_phi/media/my_drives/DATA1/data/image_benchmark/drive_content/data/LogoDet-3K/Sports/neil pryde-1/55.jpg,Sports,7.0,"The image is a simple and clean logo, which could evoke feelings of professionalism and trustworthiness. The use of a bold, sans-serif font for 'NEILPRYDE' suggests a modern and straightforward approach, possibly making one think of a company that values clarity and efficiency. The circular shape of the 'O' could be interpreted as a symbol of unity or wholeness, reinforcing the idea of a cohesive and reliable brand. There are no additional high-level features present that would significantly alter these interpretations.","The image is a simple and clean logo, which could evoke a sense of professionalism and modernity. The use of a bold, sans-serif font for the word ""NEILPRYDE"" suggests a contemporary and straightforward brand identity. The circular element with a smaller circle inside it might be interpreted as a target or a badge, which could imply precision and focus. Overall, the low-level features such as the font type and size, and the high-level features like the simplicity and the circular motif, contribute to a feeling of reliability and clarity."
/media/my_drives/DATA4/data/image_benchmark_phi/media/my_drives/DATA1/data/image_benchmark/drive_content/data/LogoDet-3K/Electronic/siragon/23.jpg,Electronic,1.0,"A person seeing the image might think and feel a sense of anticipation and excitement for the future, as suggested by the phrase 'Vive uma experiência única carregada de tecnologia. ITE sorrandirás!' which translates to 'Live a unique experience loaded with technology. You will smile.' The low-level features, such as the fingerprint-like design, may evoke thoughts of security, identity, and modern technology. The high-level features, like the bold and modern font of 'Siraggo' and the color scheme, contribute to a feeling of sophistication and innovation.","A person seeing the image might think and feel that they are viewing a promotional or informational poster for a future event or technology showcase. The low-level features such as the fingerprint-like logo, the bold and modern font used for 'Tocando el Futuro', and the use of orange and white colors give a sense of innovation and forward-thinking. The high-level features, such as the tagline 'Vive una experiencia única cargada de tecnología' and the phrase 'ITE soñarás!', suggest excitement and the promise of a unique experience related to technology. The date 'Martes 8 de octubre de 2013' indicates that the event is scheduled, adding a sense of urgency or timeliness. Overall, the image conveys a sense of anticipation for a future event that is centered around technology and innovation."
